,title,views,datetime,likes
0,Explore GeeksforGeeks Hiring Solutions | For Top Tech Companies | Innovative Hiring Solutions,484 views,4 days ago,27
1,Geek-O-Lympics 2023 | GeeksforGeeks,1.7K views,10 days ago,46
2,Web 3.0 Explained | GeeksforGeeks,1.3K views,2 weeks ago,51
3,Geek-O-Lympics 2023 | 1st - 31st July | GeeksforGeeks,1.1K views,2 weeks ago,25
4,What Is Web Scraping & What It Is Used For | How To Use Web Scraping | GeeksforGeeks,978 views,2 weeks ago,51
5,Mega Job-A-Thon | Hire Top Talent for Your Company | GeeksforGeeks,995 views,2 weeks ago,33
6,DSA To Development: A Complete Coding Guide | Complete Coding Program By GeeksforGeeks,23K views,3 weeks ago,129
7,What is Queue (Updated) | Queues Explained | GeeksforGeeks,821 views,3 weeks ago,30
8,Queue Practice Questions (Updated) | DSA Concepts | GeeksforGeeks,961 views,4 weeks ago,28
9,Free Summer Offline Classes on Python Programing | For Students Aged 14-21 | GeeksforGeeks,64K views,1 month ago,53
10,Python Libraries | Data Science | GeeksforGeeks,1.1K views,1 month ago,64
11,ITR Filing Made Simple | Documents require to file ITR | GeeksforGeeks,899 views,1 month ago,46
12,Full Stack Development | LIVE Classes | GeeksforGeeks,46K views,1 month ago,73
13,GeeksforGeeks Classroom Program in NCR,2.3K views,1 month ago,30
14,What is Arrays | Arrays Explained | New Video - GeeksforGeeks,2.1K views,1 month ago,58
15,Arrays Practice Questions (Updated) | In C++/JAVA/Python | GeeksforGeeks,2.3K views,1 month ago,91
16,Gate 2024: Prepare for Success! | GATE CSE 2024 | GeeksforGeeks,17K views,1 month ago,196
17,Get Started with CP | Competitive Programming Tips | GeeksforGeeks,2.1K views,1 month ago,57
18,React VS Angular VS Vue | GeeksforGeeks,2.3K views,2 months ago,80
19,GeeksforGeeks Classroom Program | Offline Classes in Noida,56K views,2 months ago,87
20,Transformers in NLP | GeeksforGeeks,1.6K views,2 months ago,43
21,Jobs that AI can't replace | GeeksforGeeks,2.7K views,2 months ago,72
22,Job Fair for Students | Till 25th May Only | GeeksforGeeks,82K views,2 months ago,77
23,"Flutter: ""Pros and Cons"" | GeeksforGeeks",2.2K views,2 months ago,52
24,Hire Best Talent with GeeksforGeeks,14K views,2 months ago,24
25,Tech Jobs without Degree | GeeksforGeeks,1.3K views,2 months ago,54
